title,contents,url,date
Martino DT de México sin sentimientos encontrados por enfrentar a Argentina en el Mundial,Sus declaraciones llegaron luego de conocer que se enfrentará a la selección de Argentina en la fase de grupos de la Copa del Mundo Catar 2022  dijo no tener sentimientos encontrados Yo como argentino mi función es dejar bien parada a Argentina  No suelo poner el fútbol en la misma órbita  ha hecho una eliminatoria muy buena junto con Brasil clasificó con mucha autoridad México enfrentará a Polonia el martes 22 de noviembre Tenemos casi nueve meses por delante  dijo no tener sentimientos encontrados Yo como argentino mi función es dejar bien parada a Argentina  No suelo poner el fútbol en la misma órbita  ha hecho una eliminatoria muy buena junto con Brasil clasificó con mucha autoridad México enfrentará a Polonia el martes 22 de noviembre Tenemos casi nueve meses por delante  Luego de conocer que se enfrentará a la selección de Argentina en la fase de grupos de la Copa del Mundo Catar 2022 el argentino Gerardo Martino seleccionador de México    haciendo un trabajo respetuoso y teniendo el comportamiento adecuado al lugar que tengo aquí en México dijo el Tata Martino a la televisora TUDN desde México de la nacionalidad y patriotismo añadió Martino quien no viajó a Catar para presenciar el sorteo porque el jueves se sometió en Ciudad de México a una cirugía para corregir problemas en un ojo  Respecto al presente que vive la selección argentina que será el segundo rival de México en el Grupo C de Catar 2022 Martino apuntó que la albiceleste  En la fase de grupos de Catar 2022   a Argentina el sábado 26 y a Arabia Saudita el miércoles 30 para trabajar con cada uno de ellos Este Mundial tuvo un sorteo bastante previo a la competencia y en ocho meses muchas cosas pueden cambiar dijo Martino Luego de conocer que se enfrentará a la selección de Argentina en la fase de grupos de la Copa del Mundo Catar 2022 el argentino Gerardo Martino seleccionador de México    haciendo un trabajo respetuoso y teniendo el comportamiento adecuado al lugar que tengo aquí en México dijo el Tata Martino a la televisora TUDN desde México de la nacionalidad y patriotismo añadió Martino quien no viajó a Catar para presenciar el sorteo porque el jueves se sometió en Ciudad de México a una cirugía para corregir problemas en un ojo  Respecto al presente que vive la selección argentina que será el segundo rival de México en el Grupo C de Catar 2022 Martino apuntó que la albiceleste  En la fase de grupos de Catar 2022   a Argentina el sábado 26 y a Arabia Saudita el miércoles 30 para trabajar con cada uno de ellos Este Mundial tuvo un sorteo bastante previo a la competencia y en ocho meses muchas cosas pueden cambiar dijo Martino,https://eldeber.com.bo/futbol/martino-dt-de-mexico-sin-sentimientos-encontrados-por-enfrentar-a-argentina-en-el-mundial_273229,3/4/2022
El Barcelona venció 10 al Sevilla y ya es segundo en Liga,El equipo catalán logró una importante victoria en el Camp Nou y subió a la segunda posición de la clasificación al término de la 30ª jornada del campeonato  El FC Barcelona logró una importante victoria 10 en el Camp Nou  el FC Barcelona fue incapaz de abrir el marcador hasta el minuto 72 el FC Barcelona suma ya 57 puntos el Real Betis 5º goleó 41 a Osasuna 10º  Con dos goles de Juanmi Jiménez el Athletic 8º ganó 21 en casa al Elche 15º  el Valencia 9º dio un paso atrás en sus aspiraciones europeas El Rayo llegó al descanso con ventaja de dos goles Resultados de los partidos de la 30ª jornada   Sábado  Domingo El FC Barcelona logró una importante victoria 10 en el Camp Nou  el FC Barcelona fue incapaz de abrir el marcador hasta el minuto 72 el FC Barcelona suma ya 57 puntos el Real Betis 5º goleó 41 a Osasuna 10º  Con dos goles de Juanmi Jiménez el Athletic 8º ganó 21 en casa al Elche 15º  el Valencia 9º dio un paso atrás en sus aspiraciones europeas El Rayo llegó al descanso con ventaja de dos goles Resultados de los partidos de la 30ª jornada   Sábado  Domingo contra el Sevilla 4º el domingo y dormirá en la segunda posición de la clasificación al término de la 30ª jornada de Liga A pesar de haber gozado de varias ocasiones   gracias a un disparo de Pedri González desde fuera del área Con esta victoria   en triple empate con Atlético de Madrid 3º y Sevilla 4º y con un partido menos Si bien a estas alturas luchar contra el Real Madrid 1º por el título parece ya imposible esta victoria supone un gran paso en el objetivo de los Blaugranas de clasificar a Liga de Campeones  Otro de los equipos en que busca clasificar a Champions  el domingo en el Benito Villamarín y mantiene la presión sobre el Top 4  en la primera parte 34 y 45+1 el Real Betis se fue al vestuario con media victoria asegurada El croata Ante Budimir redujo distancias para Osasuna 65 pero William Carvalho 82 y Álex Moreno 88 cerraron el partido ambos goles con asistencia de Juanmi En otros partidos disputados el domingo   gracias a los goles de Alejandro Berenguer 32 y Asier Villalibre 86 que dejaron en anecdótico el tardío gol de José Antonio Josan 90+2 Por su parte  al no pasar del empate 00 en casa frente al Cádiz 17º mientras que el Granada 16º salvó un punto 22 frente al Rayo 13º con un tanto de penal en el descuento de Luis Milla 90+4  anotados por Alejandro Catena 6 y Sergi Guardiola 17 pero se vio perjudicado por la expulsión de Santi Comesaña 51 permitiendo empatar a un Granada que marcó el primero por medio del veterano Jorge Molina 67 del campeonato de fútbol de España Getafe Mallorca 1 0 Levante Villarreal 2 0 Celta Real Madrid 1 2 Atlético de Madrid Alavés 4 1 Athletic Elche 2 1 Betis Osasuna 4 1 Granada Rayo 2 2 Valencia Cádiz 0 0 Barcelona Sevilla 1 0  Lunes 1100 Real Sociedad Espanyol contra el Sevilla 4º el domingo y dormirá en la segunda posición de la clasificación al término de la 30ª jornada de Liga A pesar de haber gozado de varias ocasiones   gracias a un disparo de Pedri González desde fuera del área Con esta victoria   en triple empate con Atlético de Madrid 3º y Sevilla 4º y con un partido menos Si bien a estas alturas luchar contra el Real Madrid 1º por el título parece ya imposible esta victoria supone un gran paso en el objetivo de los Blaugranas de clasificar a Liga de Campeones  Otro de los equipos en que busca clasificar a Champions  el domingo en el Benito Villamarín y mantiene la presión sobre el Top 4  en la primera parte 34 y 45+1 el Real Betis se fue al vestuario con media victoria asegurada El croata Ante Budimir redujo distancias para Osasuna 65 pero William Carvalho 82 y Álex Moreno 88 cerraron el partido ambos goles con asistencia de Juanmi En otros partidos disputados el domingo   gracias a los goles de Alejandro Berenguer 32 y Asier Villalibre 86 que dejaron en anecdótico el tardío gol de José Antonio Josan 90+2 Por su parte  al no pasar del empate 00 en casa frente al Cádiz 17º mientras que el Granada 16º salvó un punto 22 frente al Rayo 13º con un tanto de penal en el descuento de Luis Milla 90+4  anotados por Alejandro Catena 6 y Sergi Guardiola 17 pero se vio perjudicado por la expulsión de Santi Comesaña 51 permitiendo empatar a un Granada que marcó el primero por medio del veterano Jorge Molina 67 del campeonato de fútbol de España Getafe Mallorca 1 0 Levante Villarreal 2 0 Celta Real Madrid 1 2 Atlético de Madrid Alavés 4 1 Athletic Elche 2 1 Betis Osasuna 4 1 Granada Rayo 2 2 Valencia Cádiz 0 0 Barcelona Sevilla 1 0  Lunes 1100 Real Sociedad Espanyol,https://eldeber.com.bo/futbol/el-barcelona-vencio-1-0-al-sevilla-y-ya-es-segundo-en-liga_273241,3/4/2022
Comida reconfortante,Existen platos que tanto al cocinarlos como al probarlos son capaces de proporcionarnos emociones y una sensación de bienestar te compartimos algunas de sus recetas  ese tipo de comida que nos reconforta tanto el cuerpo como el espíritu Yo Cocino  Pasta con tomate Ingredientes Preparación Coliflor gratinada Ingredientes Preparación Escondidinho Ingredientes Para las papas Preparación ese tipo de comida que nos reconforta tanto el cuerpo como el espíritu Yo Cocino  Pasta con tomate Ingredientes Preparación Coliflor gratinada Ingredientes Preparación Escondidinho Ingredientes Para las papas Preparación ﻿ °C  °C  ﻿ °C  °C ,https://eldeber.com.bo/edicion-impresa/comida-reconfortante_272339,27/3/2022
Argentina anuncia que comprará más gas boliviano y a un mayor precio,El presidente de la argentina petrolera Ieasa Agustín Gerez informó que el precio que se pagará por el gas boliviano es de unos $us 9 por millón de BTU más algún adicional  reducirá su dependencia del costoso GNL El precio que pagará por el gas boliviano es de $us 9 por millón de BTU más algún adicional  esta semana va a llegar a entre 10 y 11 millones Vamos a llegar a 16 millones de metros por díaa mediados de año para que este acuerdo sobre el gas natural que Bolivia exporta al norte argentino sea positivo para nuestra reactivación económica YPFB ofrecía enviar hasta 9 MMm3/día en los meses de invierno y de 6 a 7 MMm3/día en los meses de verano una propuesta que luego subió hasta 12 MMm3/día Brasil requerirá menos gas boliviano por la recuperación de los embalses de sus hidroeléctricas y los volúmenes reducirá su dependencia del costoso GNL El precio que pagará por el gas boliviano es de $us 9 por millón de BTU más algún adicional  esta semana va a llegar a entre 10 y 11 millones Vamos a llegar a 16 millones de metros por díaa mediados de año para que este acuerdo sobre el gas natural que Bolivia exporta al norte argentino sea positivo para nuestra reactivación económica YPFB ofrecía enviar hasta 9 MMm3/día en los meses de invierno y de 6 a 7 MMm3/día en los meses de verano una propuesta que luego subió hasta 12 MMm3/día Brasil requerirá menos gas boliviano por la recuperación de los embalses de sus hidroeléctricas y los volúmenes Por Walter Vásquez Integración Energética Argentina Sociedad Anónima IEASA anunció que a mediados de año recibirá 16 millones de metros cúbicos MMm3 día de gas de Yacimientos Petrolíferos Fiscales Bolivianos YPFB con lo que   Ieasa quería 14 MMm3/día mientras que   para los meses más fríos del año Por Walter Vásquez Integración Energética Argentina Sociedad Anónima IEASA anunció que a mediados de año recibirá 16 millones de metros cúbicos MMm3 día de gas de Yacimientos Petrolíferos Fiscales Bolivianos YPFB con lo que   Ieasa quería 14 MMm3/día mientras que   para los meses más fríos del año,https://eldeber.com.bo/economia/argentina-anuncia-que-comprara-mas-gas-boliviano-y-a-un-mayor-precio_273217,3/4/2022
Senador pide reabrir debate de Castración Química y Cadena Perpetua para feminicidas y violadores, Tras conocerse los últimos casos de feminicidio el senador Erik Morón Creemos señaló que es momento de abrir el debate para el tratamiento del Proyecto de Ley de Castración Química y Cadena Perpetua para los feminicidas y violadores Este hecho se conoció a través de un video grabado en su cuenta de Facebook el sábado por la tarde No es posible que nuestro país se esté acostumbrado a ver los titulares de mujeres víctimas de violencia indicó el senador mientras mostraba las imágenes de los titulares de la prensa El Gobierno debe de poner un alto ante estos sucesos lamentables Este lunes pediré que se reabra el debate del proyecto sobre la Castración Química estos sujetos no tienen el mismo dolor que una madre que pierde su hija indicó El Senador de Creemos presentó un proyecto de ley en la gestión 2021 para endurecer las sanciones del Código Penal con castración química y cadena perpetua para los delitos de asesinato parricidio violación y estupro Actualmente la pena máxima que permite la legislación boliviana es de 30 años de privación de libertad sin derecho a indulto El senador Morón argumentó que decidió trabajar este proyecto de ley por la cantidad alarmante de feminicidios infanticidios violación y hasta desmembramientos En su criterio las personas que cometen estos delitos no temen a las penas que establece la normativa nacional actualmente por lo cual se deben agravar las sanciones / SVL,https://lapatria.bo/2022/04/03/senador-pide-reabrir-debate-de-castracion-quimica-y-cadena-perpetua-para-feminicidas-y-violadores/,2022/04/03
Hallan el cuerpo de Valeria en una caja en la ciudad de La Paz, El cuerpo de la joven desaparecida hace 25 días Valeria fue encontrado anoche al interior de una caja que estaba bien camuflada en una vivienda de la zona Sur de la ciudad de La Paz presuntamente en la casa de un amigo de José Luis Almanza la expareja de la víctima informó el comandante de la Policía general Jhonny Aguilera La investigación en este caso señala que Valeria llegó el 4 de marzo de Cochabamba a La Paz para encontrarse con el papá de su hijo de cuatro años José Luis A de 30 años a quien los familiares de Valeria calificaron de agresivo José Luis Almanza fue una de las últimas personas que estuvo con la víctima Se contradijo al dar explicaciones sobre su paradero en declaraciones a la Policía y fue aprehendido y cautelado en Cochabamba Asimismo tras una audiencia cautelar se ordenó una detención preventiva en la cárcel de San Pedro de La Paz para el sujeto en tanto a sus padres también son investigados por encubrimiento además de otras personas Anoche policías de la Fuerza Especial de Lucha Contra el Crimen Felcc encontraron una caja en inmediaciones de Achocalla a partir de la investigación lograron constatar que era una lavadora y al interior de ella se encontraba un cuerpo sin vida y procedieron a trasladarla aún envuelta con plástico hasta la morgue del hospital de Clínicas Se ha podido encontrar el cuerpo lo hemos trasladado a la morgue del Hospital de Clínicas de La Paz para su autopsia legal El cuerpo se encontraba embalado en una bolsa con cartón fierros y tanque de agua declaró el investigador policial El reporte preliminar sobre Valeria señala que falleció por asfixia mecánica por sofocación Al encontrar su cuerpo en un tanque de agua reforzado con varillas metálicas y envuelto en cartones y plásticos Este sujeto entrecomillas yo diría ha encajonado el cuerpo al interior de la lavadora el cual forra con un plástico de color azul y lleva a un lugar donde tiene el control obviamente tiene el control y domino sobre ese hecho añadió Aguilera El abogado de la familia de Valeria Percibal Garrón informó que las investigaciones apuntan a Luis A su expareja con quien habría consumido bebidas alcohólicas antes del asesinato Se ha podido establecer que existen vínculos donde ellos supuestamente habrían compartido bebidas alcohólicas le habría sofocado a Valeria señaló el jurista durante una entrevista con Unitel De esa manera por las condiciones en las que se encontró a Valeria el abogado sospecha que existen más personas implicadas en la muerte Una sola persona no habría podido cometer semejante crimen alguien más debió participar en este hecho enfatizó Este viernes se prevé que el ministro de Gobierno Eduardo del Castillo en conferencia de prensa de a conocer detalles de la investigación según anunció Aguilera /ABH,https://lapatria.bo/2022/04/01/hallan-el-cuerpo-de-valeria-en-una-caja-en-la-ciudad-de-la-paz/,2022/04/01
Gobierno anuncia primera Sentencia de Avocación del TCP que impide liberar a condenados a 30 años de cárcel, La primera Sentencia de Avocación del Tribunal Constitucional Plurinacional TCP N° 0001/2022 del 31 de marzo de 2022 hace más estricta la liberación de los condenados a 30 años de cárcel entre ellos feminicidas que salían con bastante facilidad a solo diagnóstico médico de enfermedad incurable Este hecho fue anunciado este domingo por la ministra de la Presidencia María Nela Prada Dijo que esta Sentencia surgió a raíz de una Acción de Libertad que subió en revisión al Tribunal Constitucional luego que un tribunal de menor jerarquía otorgara el beneficio de la detención domiciliaria al autor de un feminicidio que argumentó la violación de sus derechos a la vida por padecer de enfermedades Prada sostuvo que la Sentencia de Avocación establece jurisprudencia sobre el tratamiento de los detenidos por feminicidio parricidio infanticidio asesinato y otros que recibieron una condena de 30 años de cárcel sin derecho a indulto Manifestó que a partir de esta Sentencia los jueces ya no pueden dar salidas de manera discrecional por motivos médicos y tampoco corresponde la detención domiciliaria si el condenado no ha sido diagnosticado con enfermedad terminal que se considera aquella que no tiene tratamiento específico curativo o conlleve la muerte en un tiempo variable corto Indicó que con esto se acabó la interpretación libre que tenía cada juzgado penal que daba curso a la solicitud de salida del reo con el argumento que padecía diabetes migraña o alguna enfermedad crónica Ningún juez puede liberar a un femenicida si es que no se comprueba no solo por un informe médico sino que tiene que verificar a través del IDIF manifestó al canal estatal donde destacó que la misma sentencia ordena al Estado poner en resguardo a las víctimas de violencia evitando la revictimización La autoridad explicó que la Sentencia plantea una serie de exhortaciones de cumplimiento obligatorio al Ministerio de Gobierno para establecer un sistema informático de registro penitenciario para el cruce de información y a la Asamblea Legislativa Plurinacional ALP pidió adecuar las normas para la ejecución de penas bajo el nuevo concepto constitucional También pidió al Tribunal Supremo de Justicia y al Ministerio Público garantizar la observancia de perspectiva de género en el conocimiento y resolución de las causas y dar prioridad a la atención de casos de violencia contra las mujeres asimismo al Consejo de la Magistratura se instruyó control a los juzgados de ejecución penal /ABH,https://lapatria.bo/2022/04/03/gobierno-anuncia-primera-sentencia-de-avocacion-del-tcp-que-impide-liberar-a-condenados-a-30-anos-de-carcel/,2022/04/03
Alza de 7% al básico implica que dirigentes sumen a su sueldo un mínimo salarial,Existen dirigentes obreros que ganan hasta Bs 30000 como el caso de Rolando Borda El líder máximo de la COB accede a un salario de Bs 12000  pide un 10% al salario mínimo nacional y del 7% al básico  El ente trabajador justifica su pedido y el empresario privado exige al Ejecutivo congelar el incremento Un alto dirigente de la COB tiene un salario de Bs 30000 al mes  El mismo Borda justificó el pedido de la organización de trabajadores  Si iríamos a un petitorio de una verdadera canasta familiar estaríamos hablando de Bs 8309  Este trabajo está a la cabeza del ministro de Economía Marcelo Montenegro y el dirigente Juan Carlos Huarachi La mesa económica la estaremos convocando para el día miércoles Además el legislador afirmó que el dirigente de la COD cruceña tiene familiares trabajando en entidades públicas  El dirigente rechazó esta denuncia Al respecto Huarachi desmintió a Álvarez y aseguró que percibe un salario de Bs 15000  El dirigente no habló al respecto  El secretario ejecutivo de la Federación de Maestros de Educación Urbana de La Paz Leandro Mamani consideró que la CO Esta burocracia sindical que se ha prorrogado desde la anterior gestión lo que ha hecho es sacar un silencio sindical  Diferentes posiciones  el planteamiento presentado por Huarachi al primer mandatario del país  un pago mensual de Bs 23064 Por su parte un viceministro tendría un salario de Bs 216247 con el 7%  tiene un salario de Bs 22633 lo que implicaría que se aumente a Bs 2463331 si se aprueba el 7% demanda de los trabajadores es con el Gobierno no con los empresarios Los empresarios siempre han ratificado gestión tras gestión de que es imposible pagar un incremento salarial  pidió que los ejecutivos de la central obrera rechacen cualquier aumento de sueldos  En el caso del señor Rolando Borda es mucho cinismo intentar percibir un aumento a los 30000 bolivianos  Bs 5000 tendría un incremento de Bs 350 aplicando un 7% más   Lo que hay cuidar es la reactivación económica y manejar cifras que no dañen a los trabajadores Como legislador rechazaría el incremento pide un 10% al salario mínimo nacional y del 7% al básico  El ente trabajador justifica su pedido y el empresario privado exige al Ejecutivo congelar el incremento Un alto dirigente de la COB tiene un salario de Bs 30000 al mes  El mismo Borda justificó el pedido de la organización de trabajadores  Si iríamos a un petitorio de una verdadera canasta familiar estaríamos hablando de Bs 8309  Este trabajo está a la cabeza del ministro de Economía Marcelo Montenegro y el dirigente Juan Carlos Huarachi La mesa económica la estaremos convocando para el día miércoles Además el legislador afirmó que el dirigente de la COD cruceña tiene familiares trabajando en entidades públicas  El dirigente rechazó esta denuncia Al respecto Huarachi desmintió a Álvarez y aseguró que percibe un salario de Bs 15000  El dirigente no habló al respecto  El secretario ejecutivo de la Federación de Maestros de Educación Urbana de La Paz Leandro Mamani consideró que la CO Esta burocracia sindical que se ha prorrogado desde la anterior gestión lo que ha hecho es sacar un silencio sindical  Diferentes posiciones  el planteamiento presentado por Huarachi al primer mandatario del país  un pago mensual de Bs 23064 Por su parte un viceministro tendría un salario de Bs 216247 con el 7%  tiene un salario de Bs 22633 lo que implicaría que se aumente a Bs 2463331 si se aprueba el 7% demanda de los trabajadores es con el Gobierno no con los empresarios Los empresarios siempre han ratificado gestión tras gestión de que es imposible pagar un incremento salarial  pidió que los ejecutivos de la central obrera rechacen cualquier aumento de sueldos  En el caso del señor Rolando Borda es mucho cinismo intentar percibir un aumento a los 30000 bolivianos  Bs 5000 tendría un incremento de Bs 350 aplicando un 7% más   Lo que hay cuidar es la reactivación económica y manejar cifras que no dañen a los trabajadores Como legislador rechazaría el incremento Si el Gobierno acepta ese planteamiento implica que los principales dirigentes de la COB engrosen sus salarios con Bs 2100 más y que ministros y legisladores aumenten sus sueldos con más de Bs 1000      Si el Gobierno acepta ese planteamiento implica que los principales dirigentes de la COB engrosen sus salarios con Bs 2100 más y que ministros y legisladores aumenten sus sueldos con más de Bs 1000     ,https://eldeber.com.bo/edicion-impresa/alza-de-7-al-basico-implica-que-dirigentes-sumen-a-su-sueldo-un-minimo-salarial_273171,3/4/2022
Por qué el placer puede ser clave para perder peso,    Asocias el pastel de chocolate con culpa o celebración Tu respuesta tendrá consecuencias sorprendentes para el éxito de tu dieta dice el escritor científico David Robson    ,https://eldeber.com.bo/bbc/por-que-el-placer-puede-ser-clave-para-perder-peso_273199,3/4/2022
El erizo azul llega al siguiente nivel Sonic 2 La Película se estrena en abril ,Paramount Pictures en asociación con el Grupo SEGA Sammy traen esta cinta animada de aventura y ciencia ficción que tiene una duración de 122 minutos y añade nuevos personajes  Sonic 2 La Película Sonic hace equipo con su colega Tails Sonic 2 llevará a los espectadores de cualquier edad en una aventura donde nada menos que el destino del mundo está en peligro cinta animada de aventura y ciencia ficción que tiene una duración de 122 minutos a partir del jueves 7 de abril Sonic 2 La Película Sonic hace equipo con su colega Tails Sonic 2 llevará a los espectadores de cualquier edad en una aventura donde nada menos que el destino del mundo está en peligro cinta animada de aventura y ciencia ficción que tiene una duración de 122 minutos a partir del jueves 7 de abril    ,https://eldeber.com.bo/te-puede-interesar/el-erizo-azul-llega-al-siguiente-nivel-sonic-2-la-pelicula-se-estrena-en-abril_272942,1/4/2022
La inspiradora historia de la joven neoyorquina que reinventa el mundo de los crucigramas,Anna Shechtman con solo 19 años publicó su propio crucigrama en The New York Times ,https://eldeber.com.bo/mundo/la-inspiradora-historia-de-la-joven-neoyorquina-que-reinventa-el-mundo-de-los-crucigramas_273231,3/4/2022
