title,contents,url,date
Hallan falta de higiene en venta de jugos, En operativo sorpresa la Unidad de Defensa al Consumidor del Gobierno Autónomo Municipal de Oruro GAMO halló varias irregularidades en los puesto de venta de jugos ubicados al frente del Mercado Narciso Campero entre ellas la falta de higiene y productos sin registro sanitario por lo que se procedió a la sanción correspondiente El personal de la Unidad de Defensa al Consumidor junto a los comisarios e inspectores de área verificaron las condiciones de salubridad e inocuidad de los alimentos utilizados para la venta de jugos en la calle Velasco Galvarro y Bolívar En el operativo el jefe de la unidad suboficial Carlos Choque observó varias irregularidades en los diferentes puestos de venta de jugos como una olla llena de leche mezclada con agua fruta en estado de descomposición alimentos junto a utensilios de cocina sucios productos lácteos sin registro sanitario entre otros Recomendamos a la población orureña en su conjunto que verifiquen antes de consumir más que todos los jugos porque están mezclando agua con leche y tiene que ser servida directamente de la bolsa y hay otros productos que no tienen registro sanitario que están siendo consumidos por el usuario final manifestó Choque Asimismo la Unidad de Defensa al Consumidor recomendó a las vendedoras de jugos cumplir las condiciones de salubridad e inocuidad de los alimentos para evitar cualquier tipo de sanciones futuras Asimismo en cumplimiento a la Ley 453 la Unidad de Defensa al Consumidor realizó controles a las balanzas del sector carnes del Mercado Campero para verificar el peso precio justo en la comercialización de los productos y que las vendedoras también cumplan con las condiciones de higiene En el operativo sorpresa los comisarios y la guardia municipal comprobaron que el peso en la venta de carne en el Mercado Campero era el correcto e inclusive con un poco más Hay gente que tiene conciencia o tomando en cuenta que estamos realizando un operativo y creo que hasta están vendiendo en este caso con un poco de del peso refirió Choque,https://lapatria.bo/2022/04/02/hallan-falta-de-higiene-en-venta-de-jugos/,2022/04/02
Oruro reporta siete casos nuevos de Covid19, Las cifras de Covid19 en Oruro tienen un leve incremento este sábado se reportaron siete nuevos casos positivos 52 pacientes se recuperaron y recibieron alta epidemiológica El departamento lleva 25 días sin que se presenten fallecidos a causa de la enfermedad Además en el reporte se señala que este sábado se practicaron 267 pruebas total con siete que dieron positivo y el resto negativo El departamento suma un total de 42287 casos positivos de coronavirus 40649 pacientes recuperados 1594 decesos y actualmente hay 44 casos activos Con los nuevos casos registrados en el municipio de Oruro se tiene un acumulado de 35562 casos positivos de coronavirus seguido por Huanuni con 1521 casos Challapata 1143 Machacamarca 392 Caracollo 359 Sabaya 288 Turco 266 Salinas de Garci Mendoza 238 Antequera 218 y Eucaliptus con 214 casos Curahuara de Carangas se mantiene con 196 casos al igual que Huari con 185 positivos Huachacalla 163 Santiago de Andamarca 154 Pazña 149 Corque 133 Pampa Aullagas 103 El Choro 87 Quillacas 83 En tanto Totora 67 Huayllamarca 66 Soracachi 56 Esmeralda 43 Yunguyo de Litoral 37 Belén de Andamarca 28 Choquecota 26 Cruz de Machacamarca 26 Escara 23 Chipaya 21 Coipasa 15 La Rivera cinco Carangas y Todos Santos uno Son 34185 pacientes recuperados en el municipio de Oruro Huanuni 1471 Challapata 1081 Machacamarca 377 Caracollo 335 Sabaya 285 Turco 264 Salinas de Garci Mendoza 233 Antequera 212 Eucaliptus 202 Toledo 201 Poopó 194 Curahuara de Carangas se mantiene con 178 pacientes recuperados Huari 177 Huachacalla 157 Santiago de Andamarca 148 Pazña 146 Corque 131 Pampa Aullagas 102 El Choro 87 Quillacas 80 Huayllamarca 65 Finalmente Totora 62 Soracachi 55 Esmeralda 42 Yunguyo de Litoral 36 Belén de Andamarca 28 Choquecota 25 Cruz de Machacamarca 24 Escara 23 Chipaya 21 Coipasa 15 La Rivera cinco Todos Santos uno y finalmente Carangas uno Un solo caso nuevo de coronavirus en Oruro /ABH,https://lapatria.bo/2022/04/02/oruro-reporta-siete-casos-nuevos-de-covid-19/,2022/04/02
Cochabamba Dictan seis meses de prisión preventiva para la expareja de Valeria, Tras la audiencia de medidas cautelares que se desarrolló la jornada de este jueves en Quillacollo la Justicia dictó detención preventiva de seis meses para José Luis A expareja de Valeria quien lleva desaparecida por 25 días y que fue vista por última vez en la ciudad de La Paz El sindicado por el caso aseguró que trasladó a Valeria a la frontera con Chile donde presuntamente se dirigía para trabajar Tras su captura en la Sede de Gobierno fue trasladado a la Fuerza Especial de Lucha Contra el Crimen FELCC de Cochabamba El Comandante Departamental de la Policía Rubén Darío Lobatón informó que realizan las investigaciones «correspondientes» acerca de una presunta complicidad de la madre y el hermano del detenido «No vamos a descartar la relación en este caso tanto de la madre como del padre de este sujeto Estamos trabajando para establecer si todo lo que el sindicado dijo sobre el tema es cierto» comunicó ante los medios de comunicación En medio del clamor por justicia la familia negó que la víctima fuera capaz de abandonar a su hijo y no creen que el mensaje de «despedida» haya sido escrito por ella Según la investigación el 4 de marzo la joven llegó de Cochabamba a La Paz para encontrarse con el papá de su hijo de cuatro años Luis A de 30 años La familia de la joven indicó que su expareja es el principal sospechoso Él era agresivo con ella contó una familiar quien no pierde la esperanza de encontrar con vida a Valeria Una de las amigas de Valeria indicó que cuando ella decidió terminar la relación con su expareja todos sus amigos se alegraron Agregó que ellos seguían en contacto porque tienen un hijo en común Luis fue aprehendido el martes por ser el principal sospechoso y porque manejó tres versiones respecto al paradero de la joven dijo primero que la dejó en Pisiga luego que la dejó en Oruro y que la vio por última vez en La Paz /HNF/,https://lapatria.bo/2022/03/31/cochabamba-dictan-seis-meses-de-prision-preventiva-para-la-expareja-de-valeria/,2022/03/31
Bolívar vuelve a la cima del grupo B con goleada 60 sobre Royal Pari,La academia paceña recuperó el liderato y lo hizo con autoridad El partido se jugó en el estadio Hernando Siles de La Paz  Bolívar es nuevamente líder del grupo B del torneo Apertura  Bolívar comenzó a todo ritmo buscaron la apertura del marcador por todos los medios en un lapso de menos 11 minutos los locales hicieron tres goles La segunda conquista fue obra de Alex Granell 56 El tercero fue de Leonel Justiniano 63   y la media docena la completó Villamil 90  el equipo inmobiliario bajó al quinto puesto Bolívar será local contra Wilstermann el sábado 9 de abril  Bolívar es nuevamente líder del grupo B del torneo Apertura  Bolívar comenzó a todo ritmo buscaron la apertura del marcador por todos los medios en un lapso de menos 11 minutos los locales hicieron tres goles La segunda conquista fue obra de Alex Granell 56 El tercero fue de Leonel Justiniano 63   y la media docena la completó Villamil 90  el equipo inmobiliario bajó al quinto puesto Bolívar será local contra Wilstermann el sábado 9 de abril  La tarde de este domingo goleó a Royal Pari por 60 y llegó a 16 puntos los mismos que tienen Blooming pero la academia paceña tiene mejor diferencia de goles y se adueñó de la punta El cotejo que cerró la séptima fecha se jugó en el estadio Hernando Siles de La Paz  y estuvo a punto de madrugar a los inmobiliarios de no ser por Widen Saucedo que despejó una pelota casi sobre la línea de gol Los celestes siguieron insistiendo   pero se encontraron con un arquero Daniel Vaca inspirado que hizo crecer su figura con sus buenas intervenciones como en el minuto 26 cuando sacó dos pelotas de gol En la etapa complementaria   La apertura de la cuenta corrió por cuenta de Carlos Antonio Melgar 52 que mostró a sus compañeros el camino de la victoria  mediante la ejecución de un tiro penal A esas alturas Royal Pari jugaba con diez futbolistas debido a la expulsión de Guimer Justiniano 54 por doble amonestación amarilla quien no desperdició un tiro libre para extender la diferencia y dar la tranquilidad a los celestes El 40 nació también en un tiro libre que ejecutó Melgar el arquero Vaca dio un rebote y Gabriel Villamil 72 la empujó para ampliar la cuenta A los 76 Granell hizo el segundo de su cuenta personal y el quinto para su equipo en una jugada preparada que tuvo origen nuevamente en un tiro libre cerca del área  cuando comenzaba a jugarse tiempo adicionado Con la derrota  del grupo B con ocho puntos igual que Independiente pero tiene peor diferencia de goles En la siguiente fecha del torneo Apertura la octava  1715 Ese mismo día unas horas antes 1500 Royal Pari jugará de local contra Independiente Petrolero La tarde de este domingo goleó a Royal Pari por 60 y llegó a 16 puntos los mismos que tienen Blooming pero la academia paceña tiene mejor diferencia de goles y se adueñó de la punta El cotejo que cerró la séptima fecha se jugó en el estadio Hernando Siles de La Paz  y estuvo a punto de madrugar a los inmobiliarios de no ser por Widen Saucedo que despejó una pelota casi sobre la línea de gol Los celestes siguieron insistiendo   pero se encontraron con un arquero Daniel Vaca inspirado que hizo crecer su figura con sus buenas intervenciones como en el minuto 26 cuando sacó dos pelotas de gol En la etapa complementaria   La apertura de la cuenta corrió por cuenta de Carlos Antonio Melgar 52 que mostró a sus compañeros el camino de la victoria  mediante la ejecución de un tiro penal A esas alturas Royal Pari jugaba con diez futbolistas debido a la expulsión de Guimer Justiniano 54 por doble amonestación amarilla quien no desperdició un tiro libre para extender la diferencia y dar la tranquilidad a los celestes El 40 nació también en un tiro libre que ejecutó Melgar el arquero Vaca dio un rebote y Gabriel Villamil 72 la empujó para ampliar la cuenta A los 76 Granell hizo el segundo de su cuenta personal y el quinto para su equipo en una jugada preparada que tuvo origen nuevamente en un tiro libre cerca del área  cuando comenzaba a jugarse tiempo adicionado Con la derrota  del grupo B con ocho puntos igual que Independiente pero tiene peor diferencia de goles En la siguiente fecha del torneo Apertura la octava  1715 Ese mismo día unas horas antes 1500 Royal Pari jugará de local contra Independiente Petrolero,https://eldeber.com.bo/futbol/bolivar-vuelve-a-la-cima-del-grupo-b-con-goleada-6-0-sobre-royal-pari_273226,3/4/2022
Comisión solicita al Ministerio de Educación y sistema universitario aplicar políticas contra la violencia, En el marco de sus tareas la Comisión de Revisión de Casos de Violación y Feminicidio solicitó al Ministerio de Educación y al sistema universitario aplicar políticas de prevención de la violencia para tratar de reducir las cifras de estos delitos contra la mujer «Si no trabajamos en la educación desde la familia en los hogares que tiene que ver con la prevención vamos a seguir atacando lo que viene a ser ya el resultado de todo este sistema patriarcal que reproduce y normaliza la violencia machista» indicó la ministra de la Presidencia María Nela Prada La comisión trabaja en una serie de recomendaciones para atacar de manera interinstitucional a la violencia Por ejemplo al Ministerio Público se le pidió aplicar la perspectiva de género en el manejo de los casos y a la Asamblea Legislativa Plurinacional que coordine las actualizaciones de las normas «Son fallas estructurales que hemos encontrado en el sistema de cada una de las partes que la componen y ahí estamos yendo a atacar» dijo,https://www.la-razon.com/sociedad/2022/04/03/comision-solicita-al-ministerio-de-educacion-y-sistema-universitario-aplicar-politicas-contra-la-violencia/,2022/04/03
Will Smith pide disculpas a Chris Rock por haberlo agredido en los Óscar, El actor Will Smith pidió disculpas a Chris Rock este lunes en Instagram por haberle propinado una bofetada en la gala de los Óscar luego de que la Academia condenara el incidente que marcó la ceremonia del domingo «Quiero disculparme públicamente contigo Chris» escribió Smith quien el domingo se alzó con el primer Óscar de su carrera «Me equivoqué y estaba fuera de lugar Me siento avergonzado y mis acciones no reflejan el tipo de hombre que soy No hay lugar para la violencia en un mundo de amor y amabilidad» agregó «Quiero disculparme también con la Academia los productores de la gala los asistentes y quien estaba viendo el programa» dijo «Violencia en todas sus formas es venenosa y destructiva Mi comportamiento anoche en los premios de la Academia fue inaceptable e inexcusable» agregó Smith quien también dijo que «bromear sobre la condición médica de Jada fue demasiado para soportar y reaccioné emocionalmente» El actor también se disculpó con las hermanas Venus y Serena Williams y con su familia quienes estaban presentes en la ceremonia debido a ser el objeto de la película «Rey Richard una familia ganadora» con la cual Smith alcanzó el Óscar al mejor actor El domingo en la ceremonia del mayor premio de Hollywood Rock hizo un chiste sobre la cabeza rapada de su esposa Jada Pinkett Smith quien sufre de alopecia Su esposo Will Smith de 53 años reaccionó con una bofetada y luego gritó enfurecido «íMantén el nombre de mi esposa fuera de tu puta boca!» Minutos después al recibir el Óscar a mejor actor por su papel en «Rey Richard Una familia ganadora» se disculpó con la Academia sin mencionar la agresión ni a Rock Llorando dijo «a veces el amor te hace hacer locuras» «La Academia condena las acciones del señor Smith en el evento de anoche» dijo la organización en un comunicado  «Hemos iniciado oficialmente una revisión formal del incidente y estudiaremos otras acciones y consecuencias en concordancia con nuestros estatutos de conducta y la ley de California»,https://www.la-razon.com/la-revista/2022/03/28/will-smith-pide-disculpas-a-chris-rock-por-haberlo-agredido-en-los-oscar/,2022/03/28
El español Javier Ruibal visita La Paz en gira por tres países, Como parte de una gira por Bolivia Argentina y Paraguay el cantante español Javier Ruibal llegó a La Paz para actuar este viernes en un concierto en el que hará un repaso por su carrera El artista se presentará en el Teatro Doña Albina del Espacio Simón I Patiño avenida Ecuador 2403 a las 2000 El concierto contará con la participación especial de Jenny Cárdenas y Willy Claure El cantautor fue el invitado del programa   que se emite vía     fue la primera canción que Ruibal interpretó en la jornada musical Es una historia de amor como muchas de las que yo canto pero en un ambiente interestelar dijo sobre ella El cantautor poeta y arreglista que combina estilos de flamenco sefardímadredí jazz y rock se encuentra en una gira desde el 22 de marzo al 9 de abril Es apasionante venir siempre a Latinoamérica Vine varias veces Esta es mi segunda vez en Bolivia resaltó Ruibal cuenta con 14 discos publicados A lo largo de su carrera recibió varios reconocimientos Uno de ellos fue el premio Goya a la Mejor canción original por   de la película del mismo nombre Me apasionan muchas músicas de muchos lugares del mundo En la guitarra hay un sano contagio de las influencias de la música andina y del Caribe respondió a la consulta sobre qué le aportó Latinoamérica  fue la segunda canción que ofreció a los internautas y luego siguió   una metáfora sobre la cordura y la locura,https://www.la-razon.com/la-revista/2022/04/01/el-espanol-javier-ruibal-visita-la-paz-en-gira-por-tres-paises/,2022/04/01
Gobierno de Ecuador moviliza ataúdes y atiende heridos por motín en cárcel, El gobierno de Ecuador movilizó ataúdes y atiende a reclusos heridos durante un motín en una cárcel de la andina ciudad de Cuenca informó este domingo la secretaría de comunicación de la Presidencia sin precisar el número de víctimas Un equipo de la secretaría de Derecho Humanos se desplegó para «activar el protocolo de emergencias en el sistema penitenciario movilizando ataúdes de inmediato» a la cárcel de El Turi señaló la cartera en un comunicado Policías y militares de Ecuador intervinieron este domingo para controlar enfrentamientos en una cárcel en el sur del país informó el organismo encargado de las prisiones SNAI sin reportar víctimas En el centro penitenciario de la andina provincia de Azuay «se registraron alteraciones al orden interno ante lo cual se activaron los protocolos de seguridad y se coordinó la intervención de @PoliciaEcuador y @FFAAECUADOR para mantener la seguridad interna y externa del centro» señaló en SNAI en Twitter Por su parte la Policía reportó en la misma red social el despliegue de «unidades especializadas para ejecutar acciones de control» El año pasado las cárceles de Ecuador fueron el escenario de violentas revueltas que dejaron unos 320 reclusos muertos La masacre más reciente ocurrió en septiembre pasado en una cárcel de la provincia de Guayas suroeste donde 119 reos fallecieron algunos desmembrados e incinerados Patricio Carrillo ministro del Interior tuiteó que el gobierno «pone todo su esfuerzo para evitar que quienes desprecian la vida continúen incitando la guerra en las cárceles» Apuntó que «Ecuador ya no soporta más irracionalidad y violencia»,https://www.la-razon.com/mundo/2022/04/03/gobierno-de-ecuador-moviliza-ataudes-y-atiende-heridos-por-motin-en-carcel/,2022/04/03
Viktor Orban consigue un cuarto mandato tras ganar las elecciones en Hungría, El presidente de Hungría el nacionalista Viktor Orban obtuvo este domingo una cuarta victoria consecutiva con mucha más facilidad de la esperada en unas elecciones generales sacudidas por la guerra en Ucrania Para enfrentarlo se había formado una alianza inédita y muy dispar de seis partidos decidida a voltear al «autoritario» dirigente de 58 años Con 94% de los votos escrutados el partido Fidesz de Orban alcanzó 53% de los votos frente a 35% de la coalición opositora según la Oficina Electoral Nacional La participación fue elevada y se acercó a la movilización récord de las elecciones de 2018 «Hemos obtenido una victoria excepcional una victoria tan grande que probablemente pueda verse desde la luna y desde luego desde Bruselas» dijo Orban en un breve discurso tras la publicación de resultados oficiales parciales Vestido de negro y con el rostro serio Orban votó con su esposa Aniko Levai temprano en la mañana en un escuela de los suburbios de Budapest y prometió una «gran victoria» «Es una elección justa y equitativa» aseguró Su rival el jefe de la oposición Peter MarkiZay de 49 años reconoció la derrota la noche del domingo «No voy a ocultar mi tristeza y decepción» dijo a sus seguidores tras acusar a Fidesz de hacer una campaña de «odio y mentiras» Apodado MZP votó junto a sus siete hijos tras haber asistido a misa en su ciudad de Hodmezovasarhely sudeste y denunció las «condiciones injustas e imposibles» tendientes a permitir que su rival «permanezca eternamente en el poder» El político citó por ejemplo que apenas tuvo derecho a cinco minutos en la televisión pública que como otros medio oficiales se ha plegado a Orban «El poder de la prensa progubernamental es demasiado importante no pienso que ganaremos» dijo Flora Arpad una estudiante de 19 años que votaba por primera vez Acusado por la Comisión Europea de múltiples ataques al Estado de derecho Orban ha silenciado durante tres mandatos consecutivos a la justicia y los medios impulsando al mismo tiempo una visión ultraconservadora de la sociedad Por primera vez más de 200 observadores internacionales vigilaron los comicios Cada bando desplegó además muchos voluntarios Entre los seguidores de FideszZsuzsa Alanyi una decoradora de 44 años madre de cuatro niños destacó «las reducciones de impuestos» y las «ayudas» a las familias Al contrario para Agnes Kunyik de 56 años Orban y su partido «arruinaron a nuestro país lo destruyeron» «Queremos quedarnos en Europa queremos un Estado democrático con dirigentes racionales» dijo a la AFP,https://www.la-razon.com/mundo/2022/04/03/viktor-orban-consigue-un-cuarto-mandato-tras-ganar-las-elecciones-en-hungria/,2022/04/03
Sociedad Japonesa celebra 100 años con agenda cultural, La Sociedad Japonesa celebrará 100 años de su establecimiento en La Paz y alista un programa de actividades culturales que se iniciará en abril Festivales talleres exposiciones y un ciclo de cine son algunas de ellas La agenda conmemorativa —que se extenderá hasta noviembre— tiene el propósito de exponer y difundir cultura japonesa en el país por lo que las demostraciones serán gratuitas Esa institución fue fundada el 11 de junio de 1922 con el fin de forjar la amistad entre residentes De acuerdo con la presidenta de la comisión conmemorativa de los 100 años de la Sociedad Japonesa Carmen Hada se presentará al menos una actividad por mes La primera de ellas será el domingo 3 de abril —desde las 1000 en el Jardín Japonés Av Ballivián— donde se ofrecerá a la población los talleres de ikebana que es el arte del arreglo floral demostración de un plato típico origami que es el arte del plegado de papel y el cultivo de árboles en miniatura bonsái   Se sumará el mizuhiki que consiste en hacer nudos para decorar sobres Un nuevo arte que nunca lo hemos presentado aquí según Hada En mayo se tiene prevista una demostración de artes marciales Aunque el lugar aún no fue confirmado se prevé que sea en la plaza Tejada Sorzano Un desfile de kimonos una demostración de la ceremonia del té yaido arte marcial que tiene que ver con el desenvainado y el envainado de la katana wadaiko show de tambores y una semana de cine japonés serán la oferta en julio En agosto los interesados podrán participar en un concurso de voladores japoneses en medio de una demostración de baile y música típicas mientras que en septiembre se inaugurará una exposición de fotos antiguas sobre la historia de la institución y el Festival Omatsuri regresará en su versión presencial El Omatsuri ya es un evento tradicional que lo llevamos a cabo hace más de 15 años donde se instalan tiendas relacionadas con la cultura japonesa Comida artesanía música animé y otros productos japoneses son parte de la oferta detalló la responsable Para octubre se prepara una exposición de arte japonés y en noviembre el cierre de festejos será con el Festival Bon Odori que este año se hará en un espacio abierto La idea es recrear un ambiente de fiesta donde se baile música tradicional de ocasión con vestimenta típica como yukata y happi detalló Hada Los primeros inmigrantes japoneses llegaron a Bolivia en 1899 En 1922 crearon la Sociedad Japonesa de La Paz que cerró temporalmente en el periodo de la segunda Guerra Mundial Luego los integrantes de la comunidad japonesa propiciaron su reapertura en 1952,https://www.la-razon.com/la-revista/2022/03/29/sociedad-japonesa-celebra-100-anos-con-agenda-cultural/,2022/03/29
El joven cantautor Jhordy Apaza adelanta temas de su primer disco, El joven cantautor tarijeño Jhordy Apaza Silvestre llegó hasta los estudios de   para ofrecer un adelanto de la que será su primera producción discográfica El novel artista se inició en la música a los 15 años con la interpretación de la guitarra Según contó esa afición venía de familia porque mi papá era charanguista Las primeras apariciones en escenario de Apaza fueron como primera guitarra en grupos locales de su ciudad de nacimiento Luego también se inclinó por la composición Es así que actualmente tiene ocho temas tres de los cuales interpretó en la transmisión vía   de   Me inspiro en cosas que me pasan o incluso en sueños La música para mí es donde me desestreso y se van todos mis problemas dijo La primera canción que interpretó en los viernes culturales fue   canción que compuso para su madre Basilia a quien envió un saludo Esta canción surgió de un sueño y cada vez que la escribía me ponía a llorar La madre es algo esencial y profundo agregó sobre el tema El cantautor de 23 años reside en La Paz desde hace cuatro El motivo fue para estudiar música en el Conservatorio Actualmente trabaja como sonidista y músico Ahora me enfoco en tratar de hacer mis canciones estoy con un disco en proyecto añadió para presentar   en ritmo de polca En su página de Facebook puede encontrárselo como Jhordy Apaza espacio donde aseguró que este viernes estará disponible un nuevo video,https://www.la-razon.com/la-revista/2022/04/01/el-joven-cantautor-jhordy-apaza-adelanta-temas-de-su-primer-disco/,2022/04/01
